[
  {
    "id": "book-5-interlinear",
    "book": 5,
    "title": "Книга V · Сундараканда (подстрочник)",
    "type": "interlinear",
    "rights": "InC © М. В. Леонов; только для подписчиков, с разрешения автора — см. docs/RIGHTS.md",
    "description": "Подстрочный перевод Книги V Максима Леонова. Перевод завершён, комментарии готовы примерно на две трети.",
    "status": "in-progress",
    "fragments": [
      {
        "label": "Начало Сундараканды (глава 1, шлоки 1–10)",
        "lines": [
          "Текст подстрочника будет предоставлен — заполните этот массив строками перевода."
        ]
      }
    ]
  },
  {
    "id": "book-6-draft",
    "book": 6,
    "title": "Книга VI · Юддхаканда (черновик)",
    "type": "poetic-draft",
    "rights": "InC © М. В. Леонов; только для подписчиков, с разрешения автора — см. docs/RIGHTS.md",
    "description": "Черновой литературный перевод Книги VI Максима Леонова. Перевод готов полностью в черновом варианте.",
    "status": "draft-ready",
    "fragments": [
      {
        "label": "Фрагмент черновика",
        "lines": [
          "Текст черновика будет предоставлен — заполните этот массив строками перевода."
        ]
      }
    ]
  }
]
